Bluetooth monitor ver 5.82
btmon[15942]: = Note: Linux version 6.12.75+rpt-rpi-v8 (aarch64)                 0.385194
btmon[15942]: = Note: Bluetooth subsystem version 2.22                           0.385201
= New Index: 00:AA:01:01:00:43 (Primary,Virtual,hci1)                            0.385204
= Open Index: 00:AA:01:01:00:43                                                  0.385205
= Index Info: 00:AA:01:01:00:43 (The Linux Foundation)                           0.385208
= New Index: DC:A6:32:DC:4B:2B (Primary,UART,hci0)                               0.385209
bluetooth-meshd[15923]: @ USER Open: bluet.. (privileged) version 2.22  {0x0002} 0.385213
bluetooth-meshd[15923]: @ MGMT Open: bluet.. (privileged) version 1.23  {0x0001} 0.385215
> HCI Event: LE Meta Event (0x3e) plen 33                                     #1 0.671372
      LE Advertising Report (0x02)
        Num reports: 1
        Event type: Non connectable undirected - ADV_NONCONN_IND (0x03)
        Address type: Random (0x01)
        Address: D1:FA:95:45:1B:9C (Static)
        Data length: 21
        Mesh Beacon[19]: 00ae54597694a44a4085763b31e4f187600001
          Unprovisioned Device Beacon (0x00)
          Device UUID[16]: ae54597694a44a4085763b31e4f18760
          OOB Information: 0x0001
            Other
        01                                               .               
        RSSI: invalid (0x7f)
> HCI Event: LE Meta Event (0x3e) plen 33                                     #2 1.171341
      LE Advertising Report (0x02)
        Num reports: 1
        Event type: Non connectable undirected - ADV_NONCONN_IND (0x03)
        Address type: Random (0x01)
        Address: D1:FA:95:45:1B:9C (Static)
        Data length: 21
        Mesh Beacon[19]: 00ae54597694a44a4085763b31e4f187600001
          Unprovisioned Device Beacon (0x00)
          Device UUID[16]: ae54597694a44a4085763b31e4f18760
          OOB Information: 0x0001
            Other
        01                                               .               
        RSSI: invalid (0x7f)
> HCI Event: LE Meta Event (0x3e) plen 33                                     #3 1.671412
      LE Advertising Report (0x02)
        Num reports: 1
        Event type: Non connectable undirected - ADV_NONCONN_IND (0x03)
        Address type: Random (0x01)
        Address: D1:FA:95:45:1B:9C (Static)
        Data length: 21
        Mesh Beacon[19]: 00ae54597694a44a4085763b31e4f187600001
          Unprovisioned Device Beacon (0x00)
          Device UUID[16]: ae54597694a44a4085763b31e4f18760
          OOB Information: 0x0001
            Other
        01                                               .               
        RSSI: invalid (0x7f)
> HCI Event: LE Meta Event (0x3e) plen 33                                     #4 2.171376
      LE Advertising Report (0x02)
        Num reports: 1
        Event type: Non connectable undirected - ADV_NONCONN_IND (0x03)
        Address type: Random (0x01)
        Address: D1:FA:95:45:1B:9C (Static)
        Data length: 21
        Mesh Beacon[19]: 00ae54597694a44a4085763b31e4f187600001
          Unprovisioned Device Beacon (0x00)
          Device UUID[16]: ae54597694a44a4085763b31e4f18760
          OOB Information: 0x0001
            Other
        01                                               .               
        RSSI: invalid (0x7f)
bluetooth-meshd[15923]: < HCI Command: LE Set Advert.. (0x08|0x0006) plen 15  #5 4.020886
        Min advertising interval: 100.000 msec (0x00a0)
        Max advertising interval: 100.000 msec (0x00a0)
        Type: Non connectable undirected - ADV_NONCONN_IND (0x03)
        Own address type: Random (0x01)
        Direct address type: Public (0x00)
        Direct address: 00:00:00:00:00:00 (OUI 00-00-00)
        Channel map: 37, 38, 39 (0x07)
        Filter policy: Allow Scan Request from Accept List Only, Allow Connect Request from Accept List Only (0x03)
> HCI Event: Command Complete (0x0e) plen 4                                   #6 4.021421
      LE Set Advertising Parameters (0x08|0x0006) ncmd 1
        Status: Success (0x00)
bluetooth-meshd[15923]: < HCI Command: LE Set Advert.. (0x08|0x0008) plen 32  #7 4.021492
        Length: 24
        Mesh Beacon[22]: 0100d01fc025830c205c00000000cdd876f6cfa2bb15
          Secure Network Beacon (0x01)
          Flags: 0x01
          Network Id[8]: d01fc025830c205c
          IV Index: 0x00000000
          Authentication Value[8]: cdd876f6cfa2bb15
> HCI Event: Command Complete (0x0e) plen 4                                   #8 4.021705
      LE Set Advertising Data (0x08|0x0008) ncmd 1
        Status: Success (0x00)
bluetooth-meshd[15923]: < HCI Command: LE Set Adverti.. (0x08|0x000a) plen 1  #9 4.021754
        Advertising: Enabled (0x01)
> HCI Event: Command Complete (0x0e) plen 4                                  #10 4.021945
      LE Set Advertise Enable (0x08|0x000a) ncmd 1
        Status: Success (0x00)
bluetooth-meshd[15923]: < HCI Command: LE Set Advert.. (0x08|0x000a) plen 1  #11 4.120915
        Advertising: Disabled (0x00)
> HCI Event: Command Complete (0x0e) plen 4                                  #12 4.121166
      LE Set Advertise Enable (0x08|0x000a) ncmd 1
        Status: Success (0x00)
bluetooth-meshd[15923]: < HCI Command: LE Set Adver.. (0x08|0x0006) plen 15  #13 4.121218
        Min advertising interval: 100.000 msec (0x00a0)
        Max advertising interval: 100.000 msec (0x00a0)
        Type: Non connectable undirected - ADV_NONCONN_IND (0x03)
        Own address type: Random (0x01)
        Direct address type: Public (0x00)
        Direct address: 00:00:00:00:00:00 (OUI 00-00-00)
        Channel map: 37, 38, 39 (0x07)
        Filter policy: Allow Scan Request from Accept List Only, Allow Connect Request from Accept List Only (0x03)
> HCI Event: Command Complete (0x0e) plen 4                                  #14 4.121390
      LE Set Advertising Parameters (0x08|0x0006) ncmd 1
        Status: Success (0x00)
bluetooth-meshd[15923]: < HCI Command: LE Set Adver.. (0x08|0x0008) plen 32  #15 4.121435
        Length: 24
        Mesh Beacon[22]: 0100d01fc025830c205c00000000cdd876f6cfa2bb15
          Secure Network Beacon (0x01)
          Flags: 0x01
          Network Id[8]: d01fc025830c205c
          IV Index: 0x00000000
          Authentication Value[8]: cdd876f6cfa2bb15
> HCI Event: Command Complete (0x0e) plen 4                                  #16 4.121606
      LE Set Advertising Data (0x08|0x0008) ncmd 1
        Status: Success (0x00)
bluetooth-meshd[15923]: < HCI Command: LE Set Advert.. (0x08|0x000a) plen 1  #17 4.121666
        Advertising: Enabled (0x01)
> HCI Event: Command Complete (0x0e) plen 4                                  #18 4.123659
      LE Set Advertise Enable (0x08|0x000a) ncmd 1
        Status: Success (0x00)
bluetooth-meshd[15923]: < HCI Command: LE Set Advert.. (0x08|0x000a) plen 1  #19 4.220981
        Advertising: Disabled (0x00)
> HCI Event: Command Complete (0x0e) plen 4                                  #20 4.221284
      LE Set Advertise Enable (0x08|0x000a) ncmd 1
        Status: Success (0x00)
bluetooth-meshd[15923]: < HCI Command: LE Set Random.. (0x08|0x0005) plen 6  #21 4.221348
        Address: F0:FE:46:76:91:CC (Static)
> HCI Event: Command Complete (0x0e) plen 4                                  #22 4.221521
      LE Set Random Address (0x08|0x0005) ncmd 1
        Status: Command Disallowed (0x0c)
> HCI Event: LE Meta Event (0x3e) plen 36                                    #23 7.496006
      LE Advertising Report (0x02)
        Num reports: 1
        Event type: Non connectable undirected - ADV_NONCONN_IND (0x03)
        Address type: Random (0x01)
        Address: D1:FA:95:45:1B:9C (Static)
        Data length: 24
        Mesh Beacon[22]: 01009dbff584fdcc7dbc00000000702f10390d5ddf70
          Secure Network Beacon (0x01)
          Flags: 0x01
          Network Id[8]: 9dbff584fdcc7dbc
          IV Index: 0x00000000
          Authentication Value[8]: 702f10390d5ddf70
        RSSI: invalid (0x7f)
> HCI Event: LE Meta Event (0x3e) plen 36                                    #24 7.596013
      LE Advertising Report (0x02)
        Num reports: 1
        Event type: Non connectable undirected - ADV_NONCONN_IND (0x03)
        Address type: Random (0x01)
        Address: D1:FA:95:45:1B:9C (Static)
        Data length: 24
        Mesh Beacon[22]: 01009dbff584fdcc7dbc00000000702f10390d5ddf70
          Secure Network Beacon (0x01)
          Flags: 0x01
          Network Id[8]: 9dbff584fdcc7dbc
          IV Index: 0x00000000
          Authentication Value[8]: 702f10390d5ddf70
        RSSI: invalid (0x7f)
> HCI Event: LE Meta Event (0x3e) plen 36                                    #25 7.957275
      LE Advertising Report (0x02)
        Num reports: 1
        Event type: Non connectable undirected - ADV_NONCONN_IND (0x03)
        Address type: Random (0x01)
        Address: D1:FA:95:45:1B:9C (Static)
        Data length: 24
        Mesh Beacon[22]: 0100fbf67fbd81b4c00300000000280ffb64f01801a1
          Secure Network Beacon (0x01)
          Flags: 0x01
          Network Id[8]: fbf67fbd81b4c003
          IV Index: 0x00000000
          Authentication Value[8]: 280ffb64f01801a1
        RSSI: invalid (0x7f)
> HCI Event: LE Meta Event (0x3e) plen 36                                    #26 8.057272
      LE Advertising Report (0x02)
        Num reports: 1
        Event type: Non connectable undirected - ADV_NONCONN_IND (0x03)
        Address type: Random (0x01)
        Address: D1:FA:95:45:1B:9C (Static)
        Data length: 24
        Mesh Beacon[22]: 0100fbf67fbd81b4c00300000000280ffb64f01801a1
          Secure Network Beacon (0x01)
          Flags: 0x01
          Network Id[8]: fbf67fbd81b4c003
          IV Index: 0x00000000
          Authentication Value[8]: 280ffb64f01801a1
        RSSI: invalid (0x7f)
bluetooth-meshd[15923]: < HCI Command: LE Set Adve.. (0x08|0x0006) plen 15  #27 14.004939
        Min advertising interval: 100.000 msec (0x00a0)
        Max advertising interval: 100.000 msec (0x00a0)
        Type: Non connectable undirected - ADV_NONCONN_IND (0x03)
        Own address type: Random (0x01)
        Direct address type: Public (0x00)
        Direct address: 00:00:00:00:00:00 (OUI 00-00-00)
        Channel map: 37, 38, 39 (0x07)
        Filter policy: Allow Scan Request from Accept List Only, Allow Connect Request from Accept List Only (0x03)
> HCI Event: Command Complete (0x0e) plen 4                                 #28 14.005382
      LE Set Advertising Parameters (0x08|0x0006) ncmd 1
        Status: Success (0x00)
bluetooth-meshd[15923]: < HCI Command: LE Set Adve.. (0x08|0x0008) plen 32  #29 14.005487
        Length: 24
        Mesh Beacon[22]: 0100d01fc025830c205c00000000cdd876f6cfa2bb15
          Secure Network Beacon (0x01)
          Flags: 0x01
          Network Id[8]: d01fc025830c205c
          IV Index: 0x00000000
          Authentication Value[8]: cdd876f6cfa2bb15
> HCI Event: Command Complete (0x0e) plen 4                                 #30 14.005696
      LE Set Advertising Data (0x08|0x0008) ncmd 1
        Status: Success (0x00)
bluetooth-meshd[15923]: < HCI Command: LE Set Adver.. (0x08|0x000a) plen 1  #31 14.005749
        Advertising: Enabled (0x01)
> HCI Event: Command Complete (0x0e) plen 4                                 #32 14.005943
      LE Set Advertise Enable (0x08|0x000a) ncmd 1
        Status: Success (0x00)
bluetooth-meshd[15923]: < HCI Command: LE Set Adver.. (0x08|0x000a) plen 1  #33 14.104966
        Advertising: Disabled (0x00)
> HCI Event: Command Complete (0x0e) plen 4                                 #34 14.105211
      LE Set Advertise Enable (0x08|0x000a) ncmd 1
        Status: Success (0x00)
bluetooth-meshd[15923]: < HCI Command: LE Set Adve.. (0x08|0x0006) plen 15  #35 14.105266
        Min advertising interval: 100.000 msec (0x00a0)
        Max advertising interval: 100.000 msec (0x00a0)
        Type: Non connectable undirected - ADV_NONCONN_IND (0x03)
        Own address type: Random (0x01)
        Direct address type: Public (0x00)
        Direct address: 00:00:00:00:00:00 (OUI 00-00-00)
        Channel map: 37, 38, 39 (0x07)
        Filter policy: Allow Scan Request from Accept List Only, Allow Connect Request from Accept List Only (0x03)
> HCI Event: Command Complete (0x0e) plen 4                                 #36 14.105438
      LE Set Advertising Parameters (0x08|0x0006) ncmd 1
        Status: Success (0x00)
bluetooth-meshd[15923]: < HCI Command: LE Set Adve.. (0x08|0x0008) plen 32  #37 14.105487
        Length: 24
        Mesh Beacon[22]: 0100d01fc025830c205c00000000cdd876f6cfa2bb15
          Secure Network Beacon (0x01)
          Flags: 0x01
          Network Id[8]: d01fc025830c205c
          IV Index: 0x00000000
          Authentication Value[8]: cdd876f6cfa2bb15
> HCI Event: Command Complete (0x0e) plen 4                                 #38 14.105664
      LE Set Advertising Data (0x08|0x0008) ncmd 1
        Status: Success (0x00)
bluetooth-meshd[15923]: < HCI Command: LE Set Adver.. (0x08|0x000a) plen 1  #39 14.105719
        Advertising: Enabled (0x01)
> HCI Event: Command Complete (0x0e) plen 4                                 #40 14.105897
      LE Set Advertise Enable (0x08|0x000a) ncmd 1
        Status: Success (0x00)
bluetooth-meshd[15923]: < HCI Command: LE Set Adver.. (0x08|0x000a) plen 1  #41 14.205016
        Advertising: Disabled (0x00)
> HCI Event: Command Complete (0x0e) plen 4                                 #42 14.205275
      LE Set Advertise Enable (0x08|0x000a) ncmd 1
        Status: Success (0x00)
bluetooth-meshd[15923]: < HCI Command: LE Set Rando.. (0x08|0x0005) plen 6  #43 14.205338
        Address: EB:FB:2F:A0:F3:E9 (Static)
> HCI Event: Command Complete (0x0e) plen 4                                 #44 14.205531
      LE Set Random Address (0x08|0x0005) ncmd 1
        Status: Command Disallowed (0x0c)